[
  {
    "id": "t8103_h13g",
    "name": "Apple A14 Bionic",
    "vendor": "Apple",
    "codename": "h13g",
    "model": "T8103",
    "revision": "",
    "cores": 6,
    "threads": 6,
    "architecture": "ARMv8.5-A",
    "gpu": "Apple A14 GPU (4-core)",
    "process": "5nm",
    "year": 2020,
    "max_freq": "3.0 GHz"
  },
  {
    "id": "t8110_h14g",
    "name": "Apple M1",
    "vendor": "Apple",
    "codename": "h14g",
    "model": "T8110",
    "revision": "",
    "cores": 8,
    "threads": 8,
    "architecture": "ARMv8.5-A",
    "gpu": "Apple M1 GPU (7/8-core)",
    "process": "5nm",
    "year": 2020,
    "max_freq": "3.2 GHz"
  },
  {
    "id": "t8112_h14p",
    "name": "Apple M1 Pro",
    "vendor": "Apple",
    "codename": "h14p",
    "model": "T8112",
    "revision": "",
    "cores": 10,
    "threads": 10,
    "architecture": "ARMv8.5-A",
    "gpu": "Apple M1 Pro GPU (14/16-core)",
    "process": "5nm",
    "year": 2021,
    "max_freq": "3.2 GHz"
  },
  {
    "id": "t8116_h14m",
    "name": "Apple M1 Max",
    "vendor": "Apple",
    "codename": "h14m",
    "model": "T8116",
    "revision": "",
    "cores": 10,
    "threads": 10,
    "architecture": "ARMv8.5-A",
    "gpu": "Apple M1 Max GPU (24/32-core)",
    "process": "5nm",
    "year": 2021,
    "max_freq": "3.2 GHz"
  },
  {
    "id": "t6000_h15g",
    "name": "Apple M2",
    "vendor": "Apple",
    "codename": "h15g",
    "model": "T6000",
    "revision": "",
    "cores": 8,
    "threads": 8,
    "architecture": "ARMv8.6-A",
    "gpu": "Apple M2 GPU (10-core)",
    "process": "5nm",
    "year": 2022,
    "max_freq": "3.5 GHz"
  },
  {
    "id": "t6020_h15p",
    "name": "Apple M2 Pro",
    "vendor": "Apple",
    "codename": "h15p",
    "model": "T6020",
    "revision": "",
    "cores": 12,
    "threads": 12,
    "architecture": "ARMv8.6-A",
    "gpu": "Apple M2 Pro GPU (16/19-core)",
    "process": "5nm",
    "year": 2023,
    "max_freq": "3.5 GHz"
  },
  {
    "id": "t6021_h15m",
    "name": "Apple M2 Max",
    "vendor": "Apple",
    "codename": "h15m",
    "model": "T6021",
    "revision": "",
    "cores": 12,
    "threads": 12,
    "architecture": "ARMv8.6-A",
    "gpu": "Apple M2 Max GPU (30/38-core)",
    "process": "5nm",
    "year": 2023,
    "max_freq": "3.5 GHz"
  },
  {
    "id": "t8110_h14p_a15",
    "name": "Apple A15 Bionic",
    "vendor": "Apple",
    "codename": "h14p",
    "model": "T8110",
    "revision": "",
    "cores": 6,
    "threads": 6,
    "architecture": "ARMv8.5-A",
    "gpu": "Apple A15 GPU (4/5-core)",
    "process": "5nm",
    "year": 2021,
    "max_freq": "3.23 GHz"
  },
  {
    "id": "t8112_h14p_a16",
    "name": "Apple A16 Bionic",
    "vendor": "Apple",
    "codename": "h14p",
    "model": "T8120",
    "revision": "",
    "cores": 6,
    "threads": 6,
    "architecture": "ARMv8.6-A",
    "gpu": "Apple A16 GPU (5-core)",
    "process": "4nm",
    "year": 2022,
    "max_freq": "3.46 GHz"
  },
  {
    "id": "t8130_h15g_a17",
    "name": "Apple A17 Pro",
    "vendor": "Apple",
    "codename": "h15g",
    "model": "T8130",
    "revision": "",
    "cores": 6,
    "threads": 6,
    "architecture": "ARMv8.6-A",
    "gpu": "Apple A17 GPU (6-core)",
    "process": "3nm",
    "year": 2023,
    "max_freq": "3.78 GHz"
  },
  {
    "id": "t9500_h18g",
    "name": "Apple A18 Pro",
    "vendor": "Apple",
    "codename": "h18g",
    "model": "T9500",
    "revision": "",
    "cores": 6,
    "threads": 6,
    "architecture": "ARMv9-A",
    "gpu": "Apple A18 GPU (6-core)",
    "process": "3nm",
    "year": 2024,
    "max_freq": "4.04 GHz"
  },
  {
    "id": "t9515_h18p",
    "name": "Apple M4",
    "vendor": "Apple",
    "codename": "h18p",
    "model": "T9515",
    "revision": "",
    "cores": 10,
    "threads": 10,
    "architecture": "ARMv9-A",
    "gpu": "Apple M4 GPU (10-core)",
    "process": "3nm",
    "year": 2024,
    "max_freq": "4.4 GHz"
  }
]
